{
  "id": 1,
  "title": "Cowboy Bebop",
  "body": "string",
  "userId": 1,
  "replyUserId": 1,
  "replyCommentId": 1,
  "replyCount": 1,
  "viewCount": 1,
  "isLocked": false,
  "isSticky": false,
  "isSubscribed": false,
  "likeCount": 1,
  "isLiked": false,
  "repliedAt": 1748563200,
  "createdAt": 1748563200,
  "updatedAt": 1748563200,
  "user": {
    "id": 1,
    "name": "Sample Name",
    "about": "string",
    "avatar": {
      "large": "string",
      "medium": "string"
    },
    "bannerImage": "https://s4.anilist.co/file/anilistcdn/media/anime/cover/large/example.jpg",
    "isFollowing": false,
    "isFollower": false,
    "isBlocked": false,
    "bans": {},
    "options": {
      "titleLanguage": "ROMAJI",
      "displayAdultContent": false,
      "airingNotifications": false,
      "profileColor": "#3DB4F2",
      "notificationOptions": [
        {}
      ],
      "timezone": "string",
      "activityMergeTime": 1748563200,
      "staffNameLanguage": "ROMAJI_WESTERN",
      "restrictMessagesToFollowing": false,
      "disabledListActivity": [
        {}
      ]
    },
    "mediaListOptions": {},
    "favourites": {},
    "statistics": {},
    "unreadNotificationCount": 1,
    "siteUrl": "https://anilist.co/anime/1",
    "donatorTier": 1,
    "donatorBadge": "string",
    "moderatorRoles": [
      "ADMIN"
    ],
    "createdAt": 1748563200,
    "updatedAt": 1748563200,
    "stats": {},
    "moderatorStatus": "string",
    "previousNames": [
      {}
    ]
  },
  "replyUser": {
    "id": 1,
    "name": "Sample Name",
    "about": "string",
    "avatar": {
      "large": "string",
      "medium": "string"
    },
    "bannerImage": "https://s4.anilist.co/file/anilistcdn/media/anime/cover/large/example.jpg",
    "isFollowing": false,
    "isFollower": false,
    "isBlocked": false,
    "bans": {},
    "options": {
      "titleLanguage": "ROMAJI",
      "displayAdultContent": false,
      "airingNotifications": false,
      "profileColor": "#3DB4F2",
      "notificationOptions": [
        {}
      ],
      "timezone": "string",
      "activityMergeTime": 1748563200,
      "staffNameLanguage": "ROMAJI_WESTERN",
      "restrictMessagesToFollowing": false,
      "disabledListActivity": [
        {}
      ]
    },
    "mediaListOptions": {},
    "favourites": {},
    "statistics": {},
    "unreadNotificationCount": 1,
    "siteUrl": "https://anilist.co/anime/1",
    "donatorTier": 1,
    "donatorBadge": "string",
    "moderatorRoles": [
      "ADMIN"
    ],
    "createdAt": 1748563200,
    "updatedAt": 1748563200,
    "stats": {},
    "moderatorStatus": "string",
    "previousNames": [
      {}
    ]
  },
  "likes": [
    {
      "id": 1,
      "name": "Sample Name",
      "about": "string",
      "bannerImage": "https://s4.anilist.co/file/anilistcdn/media/anime/cover/large/example.jpg",
      "isFollowing": false,
      "isFollower": false,
      "isBlocked": false,
      "bans": {},
      "unreadNotificationCount": 1,
      "siteUrl": "https://anilist.co/anime/1",
      "donatorTier": 1,
      "donatorBadge": "string",
      "moderatorRoles": [
        "ADMIN"
      ],
      "createdAt": 1748563200,
      "updatedAt": 1748563200,
      "moderatorStatus": "string",
      "previousNames": [
        {}
      ]
    }
  ],
  "siteUrl": "https://anilist.co/anime/1",
  "categories": [
    {}
  ],
  "mediaCategories": [
    {
      "id": 1,
      "idMal": 1,
      "type": "ANIME",
      "format": "TV",
      "status": "FINISHED",
      "description": "Sample description.",
      "season": "WINTER",
      "seasonYear": 1998,
      "seasonInt": 1,
      "episodes": 26,
      "duration": 24,
      "chapters": 0,
      "volumes": 0,
      "countryOfOrigin": "string",
      "isLicensed": false,
      "source": "ORIGINAL",
      "hashtag": "string",
      "updatedAt": 1748563200,
      "bannerImage": "https://s4.anilist.co/file/anilistcdn/media/anime/cover/large/example.jpg",
      "genres": [
        "string"
      ],
      "synonyms": [
        "string"
      ],
      "averageScore": 87,
      "meanScore": 87,
      "popularity": 87,
      "isLocked": false,
      "trending": 100,
      "favourites": 87,
      "tags": [
        {}
      ],
      "isFavourite": false,
      "isFavouriteBlocked": false,
      "isAdult": false,
      "externalLinks": [
        {}
      ],
      "streamingEpisodes": [
        {}
      ],
      "rankings": [
        {}
      ],
      "siteUrl": "https://anilist.co/anime/1",
      "autoCreateForumThread": false,
      "isRecommendationBlocked": false,
      "isReviewBlocked": false,
      "modNotes": "string"
    }
  ]
}